{
  "candidates": [
    {
      "authorizes_source_moves": false,
      "candidate_id": "current-repo",
      "dimensions": {
        "cross_family_colocations": 1312,
        "largest_workspace_components": 44,
        "legacy_canonical_colocations": 0,
        "mixed_visibility_workspaces": 0,
        "source_repository_split_count": 0,
        "workspace_count": 12
      },
      "hard_blockers": [],
      "target_architecture_claim": false,
      "workspaces": [
        {
          "component_ids": [
            "ag:component:atlas"
          ],
          "visibility": "public",
          "workspace_id": "Aftergraph/aftergraph.org"
        },
        {
          "component_ids": [
            "ag:legacy:avc:agent-eval",
            "ag:legacy:avc:agent-gateway",
            "ag:legacy:avc:agent-harness",
            "ag:legacy:avc:agent-observability",
            "ag:legacy:avc:agent-relay",
            "ag:legacy:avc:avc-desktop",
            "ag:legacy:avc:avc-eval",
            "ag:legacy:avc:avc-llm",
            "ag:legacy:avc:cli",
            "ag:legacy:avc:company-daemon",
            "ag:legacy:avc:constitution",
            "ag:legacy:avc:contracts",
            "ag:legacy:avc:creative-assets",
            "ag:legacy:avc:events",
            "ag:legacy:avc:hermes-adapter",
            "ag:legacy:avc:identity-core",
            "ag:legacy:avc:identity-worker",
            "ag:legacy:avc:incident",
            "ag:legacy:avc:intelligence-gateway",
            "ag:legacy:avc:invariant-registry",
            "ag:legacy:avc:job-runtime",
            "ag:legacy:avc:kernel-core",
            "ag:legacy:avc:leadrescue",
            "ag:legacy:avc:ledger",
            "ag:legacy:avc:memory-store",
            "ag:legacy:avc:mission-graph",
            "ag:legacy:avc:mission-graph-authority",
            "ag:legacy:avc:model-edge",
            "ag:legacy:avc:orchestrator",
            "ag:legacy:avc:peer-protocol",
            "ag:legacy:avc:plugin-deepsec",
            "ag:legacy:avc:portfolio",
            "ag:legacy:avc:proactive-runtime",
            "ag:legacy:avc:product-catalog",
            "ag:legacy:avc:product-installer-adapter",
            "ag:legacy:avc:runner-bridge",
            "ag:legacy:avc:runtime-metrics",
            "ag:legacy:avc:runtime-orchestrator",
            "ag:legacy:avc:security-assurance",
            "ag:legacy:avc:serviceops",
            "ag:legacy:avc:serviceops-mcp",
            "ag:legacy:avc:telemetry",
            "ag:legacy:avc:tenant-core",
            "ag:legacy:avc:visual-verifier"
          ],
          "visibility": "private",
          "workspace_id": "Aftergraph/autonomous-venture-company"
        },
        {
          "component_ids": [
            "ag:component:brand"
          ],
          "visibility": "public",
          "workspace_id": "Aftergraph/brand"
        },
        {
          "component_ids": [
            "ag:component:business-ops"
          ],
          "visibility": "private",
          "workspace_id": "Aftergraph/business-ops"
        },
        {
          "component_ids": [
            "ag:component:docs"
          ],
          "visibility": "public",
          "workspace_id": "Aftergraph/docs"
        },
        {
          "component_ids": [
            "ag:component:relay"
          ],
          "visibility": "private",
          "workspace_id": "Aftergraph/relay"
        },
        {
          "component_ids": [
            "ag:component:rendetalje"
          ],
          "visibility": "private",
          "workspace_id": "Aftergraph/rendetalje"
        },
        {
          "component_ids": [
            "ag:component:agent-eval",
            "ag:component:agent-harness",
            "ag:component:agent-relay",
            "ag:component:authorization",
            "ag:component:constitution",
            "ag:component:contracts",
            "ag:component:definitions",
            "ag:component:events",
            "ag:component:goals",
            "ag:component:heartbeat",
            "ag:component:identity-core",
            "ag:component:incident",
            "ag:component:intelligence-gateway",
            "ag:component:invariants",
            "ag:component:job-runtime",
            "ag:component:kernel-core",
            "ag:component:ledger",
            "ag:component:memory-store",
            "ag:component:metrics",
            "ag:component:mission-graph",
            "ag:component:mission-inference",
            "ag:component:mission-routing",
            "ag:component:muse-supervisor",
            "ag:component:observability",
            "ag:component:orchestrator",
            "ag:component:outcomes",
            "ag:component:peer-protocol",
            "ag:component:portfolio",
            "ag:component:proactive-runtime",
            "ag:component:promotion-gates",
            "ag:component:runtime",
            "ag:component:runtime-host",
            "ag:component:scheduler",
            "ag:component:telemetry",
            "ag:component:tenant-core",
            "ag:component:triggers"
          ],
          "visibility": "private",
          "workspace_id": "Aftergraph/runtime"
        },
        {
          "component_ids": [
            "ag:component:sentinel"
          ],
          "visibility": "public",
          "workspace_id": "Aftergraph/sentinel"
        },
        {
          "component_ids": [
            "ag:component:studio"
          ],
          "visibility": "public",
          "workspace_id": "Aftergraph/studio"
        },
        {
          "component_ids": [
            "ag:component:veranza",
            "ag:component:veranza-control",
            "ag:component:veranza-detect",
            "ag:component:veranza-evidence",
            "ag:component:veranza-gateway",
            "ag:component:veranza-identity",
            "ag:component:veranza-ledger",
            "ag:component:veranza-runtime"
          ],
          "visibility": "private",
          "workspace_id": "Aftergraph/veranza"
        },
        {
          "component_ids": [
            "ag:component:work-intelligence"
          ],
          "visibility": "public",
          "workspace_id": "Aftergraph/wi-backend"
        }
      ]
    },
    {
      "authorizes_source_moves": false,
      "candidate_id": "family-only",
      "dimensions": {
        "cross_family_colocations": 0,
        "largest_workspace_components": 25,
        "legacy_canonical_colocations": 348,
        "mixed_visibility_workspaces": 4,
        "source_repository_split_count": 14,
        "workspace_count": 10
      },
      "hard_blockers": [
        {
          "id": "mixed-visibility"
        }
      ],
      "target_architecture_claim": false,
      "workspaces": [
        {
          "component_ids": [
            "ag:component:brand",
            "ag:component:contracts",
            "ag:component:definitions",
            "ag:component:docs",
            "ag:legacy:avc:contracts",
            "ag:legacy:avc:creative-assets"
          ],
          "visibility": "MIXED",
          "workspace_id": "COMMONS"
        },
        {
          "component_ids": [
            "ag:component:authorization",
            "ag:component:constitution",
            "ag:component:identity-core",
            "ag:component:invariants",
            "ag:component:promotion-gates",
            "ag:component:tenant-core",
            "ag:legacy:avc:constitution",
            "ag:legacy:avc:identity-core",
            "ag:legacy:avc:identity-worker",
            "ag:legacy:avc:invariant-registry",
            "ag:legacy:avc:mission-graph-authority",
            "ag:legacy:avc:tenant-core"
          ],
          "visibility": "private",
          "workspace_id": "COVENANT_SUPPORT"
        },
        {
          "component_ids": [
            "ag:component:business-ops",
            "ag:component:rendetalje",
            "ag:legacy:avc:leadrescue",
            "ag:legacy:avc:serviceops",
            "ag:legacy:avc:serviceops-mcp"
          ],
          "visibility": "private",
          "workspace_id": "DOMAIN"
        },
        {
          "component_ids": [
            "ag:component:agent-relay",
            "ag:component:events",
            "ag:component:heartbeat",
            "ag:component:job-runtime",
            "ag:component:kernel-core",
            "ag:component:orchestrator",
            "ag:component:peer-protocol",
            "ag:component:proactive-runtime",
            "ag:component:runtime",
            "ag:component:runtime-host",
            "ag:component:scheduler",
            "ag:component:triggers",
            "ag:legacy:avc:agent-gateway",
            "ag:legacy:avc:agent-relay",
            "ag:legacy:avc:company-daemon",
            "ag:legacy:avc:events",
            "ag:legacy:avc:hermes-adapter",
            "ag:legacy:avc:job-runtime",
            "ag:legacy:avc:kernel-core",
            "ag:legacy:avc:orchestrator",
            "ag:legacy:avc:peer-protocol",
            "ag:legacy:avc:proactive-runtime",
            "ag:legacy:avc:product-installer-adapter",
            "ag:legacy:avc:runner-bridge",
            "ag:legacy:avc:runtime-orchestrator"
          ],
          "visibility": "private",
          "workspace_id": "DRIVE"
        },
        {
          "component_ids": [
            "ag:component:atlas",
            "ag:component:relay",
            "ag:component:studio",
            "ag:legacy:avc:avc-desktop",
            "ag:legacy:avc:cli"
          ],
          "visibility": "MIXED",
          "workspace_id": "EXPERIENCE"
        },
        {
          "component_ids": [
            "ag:component:goals",
            "ag:component:intelligence-gateway",
            "ag:component:ledger",
            "ag:component:memory-store",
            "ag:component:mission-graph",
            "ag:component:mission-inference",
            "ag:component:mission-routing",
            "ag:component:muse-supervisor",